{
  "aibdp_version": "0.2",
  "canonical_uri": "http://localhost:3000/.well-known/aibdp.json",
  "contact": "mailto:admin@example.org",
  "expires": "2026-07-20T23:59:59Z",
  "policy_uri": "http://localhost:3000/ai-policy",

  "policies": {
    "training": {
      "status": "conditional",
      "conditions": [
        "Attribution required to 'Example Organization'",
        "Non-commercial use only",
        "Preserve context and source links"
      ],
      "scope": ["/article.html", "/docs/**"],
      "exceptions": [
        {
          "path": "/public.html",
          "status": "allowed",
          "note": "Public domain content, no restrictions"
        }
      ]
    },

    "indexing": {
      "status": "allowed",
      "scope": "all",
      "note": "Full indexing permitted for search and discovery"
    },

    "summarization": {
      "status": "allowed",
      "conditions": ["Maintain accuracy", "Cite source URL"]
    },

    "question_answering": {
      "status": "allowed",
      "conditions": ["Cite source with URL"],
      "note": "RAG systems may reference this content"
    },

    "generation": {
      "status": "refused",
      "rationale": "Content should not be synthetically replicated or used to generate derivative works",
      "alternatives": "Link to original content with attribution instead"
    },

    "fine_tuning": {
      "status": "encouraged",
      "purpose": [
        "Educational tools",
        "Accessibility features",
        "Translation services"
      ],
      "note": "Fine-tuning for user benefit is encouraged"
    },

    "embedding": {
      "status": "allowed",
      "conditions": ["For semantic search and retrieval only"]
    },

    "commercial_training": {
      "status": "conditional",
      "conditions": [
        "Attribution in model documentation",
        "Financial contribution to project",
        "Do not claim content as proprietary"
      ],
      "note": "Commercial AI development requires transparent attribution"
    }
  },

  "scope": {
    "applies_to": [
      "LLM training and fine-tuning",
      "Search engine indexing",
      "RAG systems",
      "Code completion tools",
      "Documentation summarization"
    ]
  },

  "special_provisions": {
    "academic_research": {
      "status": "unrestricted",
      "note": "All content available for academic research. Please cite properly."
    },

    "educational_use": {
      "status": "encouraged",
      "note": "Use in courses and tutorials is strongly encouraged with attribution"
    }
  },

  "enforcement": {
    "mechanism": "http_430",
    "note": "Violations result in HTTP 430 Consent Required responses",
    "contact_before_litigation": true,
    "preferred_resolution": "dialogue and boundary clarification"
  },

  "metadata": {
    "created": "2025-07-20",
    "last_modified": "2025-07-20",
    "author": "Example Organization",
    "organization": "Example Org",
    "project": "Consent-Aware HTTP Example"
  },

  "philosophy": {
    "core_principle": "Without refusal, permission is meaningless",
    "values": [
      "Declarative refusal as care",
      "Transparent infrastructure",
      "Pro-boundary, not anti-AI"
    ]
  }
}
